{"generado":"2026-10-16T09:04:44Z","corridas":{"n":380,"desde":"2026-10-16","hasta":"2026-10-16","modelos":[{"proveedor":"google","modelo":"gemini-3.8-flash","herramienta":"google_search"},{"proveedor":"openai","modelo":"gpt-5-mini-2025-08-07","herramienta":"web_search"}],"prompts_por_idioma":{"es":9,"en":4,"fr":3,"ko":3,"zh":3},"repeticiones":10},"segmentos":[{"proveedor":"todos","idioma":"todos","tono":"todos","destinos":[{"destino_id":"acatzingo","n":380,"k":1,"pct":0.3,"ic95_bajo":0.0,"ic95_alto":1.5},{"destino_id":"atlixco","n":380,"k":211,"pct":55.5,"ic95_bajo":50.5,"ic95_alto":60.4},{"destino_id":"chignahuapan","n":380,"k":193,"pct":50.8,"ic95_bajo":45.8,"ic95_alto":55.8},{"destino_id":"cholula","n":380,"k":299,"pct":78.7,"ic95_bajo":74.3,"ic95_alto":82.5},{"destino_id":"cuetzalan","n":380,"k":211,"pct":55.5,"ic95_bajo":50.5,"ic95_alto":60.4},{"destino_id":"huauchinango","n":380,"k":43,"pct":11.3,"ic95_bajo":8.5,"ic95_alto":14.9},{"destino_id":"huejotzingo","n":380,"k":97,"pct":25.5,"ic95_bajo":21.4,"ic95_alto":30.1},{"destino_id":"izucar-de-matamoros","n":380,"k":3,"pct":0.8,"ic95_bajo":0.3,"ic95_alto":2.3},{"destino_id":"pahuatlan","n":380,"k":68,"pct":17.9,"ic95_bajo":14.4,"ic95_alto":22.1},{"destino_id":"puebla","n":380,"k":278,"pct":73.2,"ic95_bajo":68.5,"ic95_alto":77.4},{"destino_id":"san-martin-texmelucan","n":380,"k":2,"pct":0.5,"ic95_bajo":0.1,"ic95_alto":1.9},{"destino_id":"tehuacan","n":380,"k":81,"pct":21.3,"ic95_bajo":17.5,"ic95_alto":25.7},{"destino_id":"tepeaca","n":380,"k":4,"pct":1.1,"ic95_bajo":0.4,"ic95_alto":2.7},{"destino_id":"tetela-de-ocampo","n":380,"k":69,"pct":18.2,"ic95_bajo":14.6,"ic95_alto":22.3},{"destino_id":"teziutlan","n":380,"k":24,"pct":6.3,"ic95_bajo":4.3,"ic95_alto":9.2},{"destino_id":"tlatlauquitepec","n":380,"k":112,"pct":29.5,"ic95_bajo":25.1,"ic95_alto":34.2},{"destino_id":"xicotepec","n":380,"k":44,"pct":11.6,"ic95_bajo":8.7,"ic95_alto":15.2},{"destino_id":"zacatlan","n":380,"k":216,"pct":56.8,"ic95_bajo":51.8,"ic95_alto":61.7}]},{"proveedor":"openai","idioma":"todos","tono":"todos","destinos":[{"destino_id":"acatzingo","n":160,"k":0,"pct":0.0,"ic95_bajo":0.0,"ic95_alto":2.3},{"destino_id":"atlixco","n":160,"k":79,"pct":49.4,"ic95_bajo":41.7,"ic95_alto":57.0},{"destino_id":"chignahuapan","n":160,"k":90,"pct":56.2,"ic95_bajo":48.5,"ic95_alto":63.7},{"destino_id":"cholula","n":160,"k":112,"pct":70.0,"ic95_bajo":62.5,"ic95_alto":76.6},{"destino_id":"cuetzalan","n":160,"k":89,"pct":55.6,"ic95_bajo":47.9,"ic95_alto":63.1},{"destino_id":"huauchinango","n":160,"k":39,"pct":24.4,"ic95_bajo":18.4,"ic95_alto":31.6},{"destino_id":"huejotzingo","n":160,"k":50,"pct":31.2,"ic95_bajo":24.6,"ic95_alto":38.8},{"destino_id":"izucar-de-matamoros","n":160,"k":2,"pct":1.2,"ic95_bajo":0.3,"ic95_alto":4.4},{"destino_id":"pahuatlan","n":160,"k":37,"pct":23.1,"ic95_bajo":17.3,"ic95_alto":30.2},{"destino_id":"puebla","n":160,"k":130,"pct":81.2,"ic95_bajo":74.5,"ic95_alto":86.5},{"destino_id":"san-martin-texmelucan","n":160,"k":1,"pct":0.6,"ic95_bajo":0.1,"ic95_alto":3.5},{"destino_id":"tehuacan","n":160,"k":21,"pct":13.1,"ic95_bajo":8.7,"ic95_alto":19.2},{"destino_id":"tepeaca","n":160,"k":1,"pct":0.6,"ic95_bajo":0.1,"ic95_alto":3.5},{"destino_id":"tetela-de-ocampo","n":160,"k":41,"pct":25.6,"ic95_bajo":19.5,"ic95_alto":32.9},{"destino_id":"teziutlan","n":160,"k":20,"pct":12.5,"ic95_bajo":8.2,"ic95_alto":18.5},{"destino_id":"tlatlauquitepec","n":160,"k":37,"pct":23.1,"ic95_bajo":17.3,"ic95_alto":30.2},{"destino_id":"xicotepec","n":160,"k":33,"pct":20.6,"ic95_bajo":15.1,"ic95_alto":27.5},{"destino_id":"zacatlan","n":160,"k":101,"pct":63.1,"ic95_bajo":55.4,"ic95_alto":70.2}]},{"proveedor":"google","idioma":"todos","tono":"todos","destinos":[{"destino_id":"acatzingo","n":220,"k":1,"pct":0.5,"ic95_bajo":0.1,"ic95_alto":2.5},{"destino_id":"atlixco","n":220,"k":132,"pct":60.0,"ic95_bajo":53.4,"ic95_alto":66.2},{"destino_id":"chignahuapan","n":220,"k":103,"pct":46.8,"ic95_bajo":40.3,"ic95_alto":53.4},{"destino_id":"cholula","n":220,"k":187,"pct":85.0,"ic95_bajo":79.7,"ic95_alto":89.1},{"destino_id":"cuetzalan","n":220,"k":122,"pct":55.5,"ic95_bajo":48.8,"ic95_alto":61.9},{"destino_id":"huauchinango","n":220,"k":4,"pct":1.8,"ic95_bajo":0.7,"ic95_alto":4.6},{"destino_id":"huejotzingo","n":220,"k":47,"pct":21.4,"ic95_bajo":16.5,"ic95_alto":27.2},{"destino_id":"izucar-de-matamoros","n":220,"k":1,"pct":0.5,"ic95_bajo":0.1,"ic95_alto":2.5},{"destino_id":"pahuatlan","n":220,"k":31,"pct":14.1,"ic95_bajo":10.1,"ic95_alto":19.3},{"destino_id":"puebla","n":220,"k":148,"pct":67.3,"ic95_bajo":60.8,"ic95_alto":73.1},{"destino_id":"san-martin-texmelucan","n":220,"k":1,"pct":0.5,"ic95_bajo":0.1,"ic95_alto":2.5},{"destino_id":"tehuacan","n":220,"k":60,"pct":27.3,"ic95_bajo":21.8,"ic95_alto":33.5},{"destino_id":"tepeaca","n":220,"k":3,"pct":1.4,"ic95_bajo":0.5,"ic95_alto":3.9},{"destino_id":"tetela-de-ocampo","n":220,"k":28,"pct":12.7,"ic95_bajo":9.0,"ic95_alto":17.8},{"destino_id":"teziutlan","n":220,"k":4,"pct":1.8,"ic95_bajo":0.7,"ic95_alto":4.6},{"destino_id":"tlatlauquitepec","n":220,"k":75,"pct":34.1,"ic95_bajo":28.1,"ic95_alto":40.6},{"destino_id":"xicotepec","n":220,"k":11,"pct":5.0,"ic95_bajo":2.8,"ic95_alto":8.7},{"destino_id":"zacatlan","n":220,"k":115,"pct":52.3,"ic95_bajo":45.7,"ic95_alto":58.8}]},{"proveedor":"todos","idioma":"es","tono":"todos","destinos":[{"destino_id":"acatzingo","n":180,"k":0,"pct":0.0,"ic95_bajo":0.0,"ic95_alto":2.1},{"destino_id":"atlixco","n":180,"k":86,"pct":47.8,"ic95_bajo":40.6,"ic95_alto":55.0},{"destino_id":"chignahuapan","n":180,"k":112,"pct":62.2,"ic95_bajo":55.0,"ic95_alto":69.0},{"destino_id":"cholula","n":180,"k":107,"pct":59.4,"ic95_bajo":52.1,"ic95_alto":66.3},{"destino_id":"cuetzalan","n":180,"k":117,"pct":65.0,"ic95_bajo":57.8,"ic95_alto":71.6},{"destino_id":"huauchinango","n":180,"k":33,"pct":18.3,"ic95_bajo":13.4,"ic95_alto":24.6},{"destino_id":"huejotzingo","n":180,"k":35,"pct":19.4,"ic95_bajo":14.3,"ic95_alto":25.8},{"destino_id":"izucar-de-matamoros","n":180,"k":3,"pct":1.7,"ic95_bajo":0.6,"ic95_alto":4.8},{"destino_id":"pahuatlan","n":180,"k":48,"pct":26.7,"ic95_bajo":20.7,"ic95_alto":33.6},{"destino_id":"puebla","n":180,"k":125,"pct":69.4,"ic95_bajo":62.4,"ic95_alto":75.7},{"destino_id":"san-martin-texmelucan","n":180,"k":2,"pct":1.1,"ic95_bajo":0.3,"ic95_alto":4.0},{"destino_id":"tehuacan","n":180,"k":35,"pct":19.4,"ic95_bajo":14.3,"ic95_alto":25.8},{"destino_id":"tepeaca","n":180,"k":1,"pct":0.6,"ic95_bajo":0.1,"ic95_alto":3.1},{"destino_id":"tetela-de-ocampo","n":180,"k":55,"pct":30.6,"ic95_bajo":24.3,"ic95_alto":37.6},{"destino_id":"teziutlan","n":180,"k":15,"pct":8.3,"ic95_bajo":5.1,"ic95_alto":13.3},{"destino_id":"tlatlauquitepec","n":180,"k":73,"pct":40.6,"ic95_bajo":33.7,"ic95_alto":47.9},{"destino_id":"xicotepec","n":180,"k":37,"pct":20.6,"ic95_bajo":15.3,"ic95_alto":27.0},{"destino_id":"zacatlan","n":180,"k":125,"pct":69.4,"ic95_bajo":62.4,"ic95_alto":75.7}]},{"proveedor":"openai","idioma":"es","tono":"todos","destinos":[{"destino_id":"acatzingo","n":90,"k":0,"pct":0.0,"ic95_bajo":0.0,"ic95_alto":4.1},{"destino_id":"atlixco","n":90,"k":39,"pct":43.3,"ic95_bajo":33.6,"ic95_alto":53.6},{"destino_id":"chignahuapan","n":90,"k":55,"pct":61.1,"ic95_bajo":50.8,"ic95_alto":70.5},{"destino_id":"cholula","n":90,"k":50,"pct":55.6,"ic95_bajo":45.3,"ic95_alto":65.4},{"destino_id":"cuetzalan","n":90,"k":59,"pct":65.6,"ic95_bajo":55.3,"ic95_alto":74.6},{"destino_id":"huauchinango","n":90,"k":29,"pct":32.2,"ic95_bajo":23.5,"ic95_alto":42.4},{"destino_id":"huejotzingo","n":90,"k":22,"pct":24.4,"ic95_bajo":16.7,"ic95_alto":34.2},{"destino_id":"izucar-de-matamoros","n":90,"k":2,"pct":2.2,"ic95_bajo":0.6,"ic95_alto":7.7},{"destino_id":"pahuatlan","n":90,"k":26,"pct":28.9,"ic95_bajo":20.5,"ic95_alto":39.0},{"destino_id":"puebla","n":90,"k":73,"pct":81.1,"ic95_bajo":71.8,"ic95_alto":87.9},{"destino_id":"san-martin-texmelucan","n":90,"k":1,"pct":1.1,"ic95_bajo":0.2,"ic95_alto":6.0},{"destino_id":"tehuacan","n":90,"k":12,"pct":13.3,"ic95_bajo":7.8,"ic95_alto":21.9},{"destino_id":"tepeaca","n":90,"k":0,"pct":0.0,"ic95_bajo":0.0,"ic95_alto":4.1},{"destino_id":"tetela-de-ocampo","n":90,"k":29,"pct":32.2,"ic95_bajo":23.5,"ic95_alto":42.4},{"destino_id":"teziutlan","n":90,"k":12,"pct":13.3,"ic95_bajo":7.8,"ic95_alto":21.9},{"destino_id":"tlatlauquitepec","n":90,"k":30,"pct":33.3,"ic95_bajo":24.5,"ic95_alto":43.6},{"destino_id":"xicotepec","n":90,"k":26,"pct":28.9,"ic95_bajo":20.5,"ic95_alto":39.0},{"destino_id":"zacatlan","n":90,"k":62,"pct":68.9,"ic95_bajo":58.7,"ic95_alto":77.5}]},{"proveedor":"google","idioma":"es","tono":"todos","destinos":[{"destino_id":"acatzingo","n":90,"k":0,"pct":0.0,"ic95_bajo":0.0,"ic95_alto":4.1},{"destino_id":"atlixco","n":90,"k":47,"pct":52.2,"ic95_bajo":42.0,"ic95_alto":62.2},{"destino_id":"chignahuapan","n":90,"k":57,"pct":63.3,"ic95_bajo":53.0,"ic95_alto":72.6},{"destino_id":"cholula","n":90,"k":57,"pct":63.3,"ic95_bajo":53.0,"ic95_alto":72.6},{"destino_id":"cuetzalan","n":90,"k":58,"pct":64.4,"ic95_bajo":54.2,"ic95_alto":73.6},{"destino_id":"huauchinango","n":90,"k":4,"pct":4.4,"ic95_bajo":1.7,"ic95_alto":10.9},{"destino_id":"huejotzingo","n":90,"k":13,"pct":14.4,"ic95_bajo":8.6,"ic95_alto":23.2},{"destino_id":"izucar-de-matamoros","n":90,"k":1,"pct":1.1,"ic95_bajo":0.2,"ic95_alto":6.0},{"destino_id":"pahuatlan","n":90,"k":22,"pct":24.4,"ic95_bajo":16.7,"ic95_alto":34.2},{"destino_id":"puebla","n":90,"k":52,"pct":57.8,"ic95_bajo":47.5,"ic95_alto":67.5},{"destino_id":"san-martin-texmelucan","n":90,"k":1,"pct":1.1,"ic95_bajo":0.2,"ic95_alto":6.0},{"destino_id":"tehuacan","n":90,"k":23,"pct":25.6,"ic95_bajo":17.7,"ic95_alto":35.4},{"destino_id":"tepeaca","n":90,"k":1,"pct":1.1,"ic95_bajo":0.2,"ic95_alto":6.0},{"destino_id":"tetela-de-ocampo","n":90,"k":26,"pct":28.9,"ic95_bajo":20.5,"ic95_alto":39.0},{"destino_id":"teziutlan","n":90,"k":3,"pct":3.3,"ic95_bajo":1.1,"ic95_alto":9.3},{"destino_id":"tlatlauquitepec","n":90,"k":43,"pct":47.8,"i